,id,listing_url,scrape_id,last_scraped,source,name,description,neighborhood_overview,picture_url,host_id,host_url,host_name,host_since,host_location,host_about,host_response_time,host_response_rate,host_acceptance_rate,host_is_superhost,host_thumbnail_url,host_picture_url,host_neighbourhood,host_listings_count,host_total_listings_count,host_verifications,host_has_profile_pic,host_identity_verified,neighbourhood,neighbourhood_cleansed,neighbourhood_group_cleansed,latitude,longitude,property_type,room_type,accommodates,bathrooms,bathrooms_text,bedrooms,beds,amenities,price,minimum_nights,maximum_nights,minimum_minimum_nights,maximum_minimum_nights,minimum_maximum_nights,maximum_maximum_nights,minimum_nights_avg_ntm,maximum_nights_avg_ntm,calendar_updated,has_availability,availability_30,availability_60,availability_90,availability_365,calendar_last_scraped,number_of_reviews,number_of_reviews_ltm,number_of_reviews_l30d,first_review,last_review,review_scores_rating,review_scores_accuracy,review_scores_cleanliness,review_scores_checkin,review_scores_communication,review_scores_location,review_scores_value,license,instant_bookable,calculated_host_listings_count,calculated_host_listings_count_entire_homes,calculated_host_listings_count_private_rooms,calculated_host_listings_count_shared_rooms,reviews_per_month
0,35644,https://www.airbnb.com/rooms/35644,20240905032138,2024-09-05,previous scrape,Central Hobart Historic Cottage,"This renovated 1885 house has fantastic views & is an easy walk to city centre, or a stroll to the North Hobart cafe/restaurant strip.  <br /><br />It is a vegetarian household, so if you're a carnivore you'll need to engage your inner vego while at home :-)","This part of West Hobart is heritage listed and one of the oldest parts of Hobart. It is very central, being on the edge of the CBD. There are many cafes, bars and restaurants nearby, with the cafe/restaurant strip in Elizabeth Street North Hobart a short walk away, and Salamanca a 20 minute walk. The renowned Hill Street Grocer is a 5 minute walk away if you want to stock up on quality food stuffs (they also sell prepared heat-and-eat meals), and Smolt Kitchen, Pigeon Whole Bakery Cafe & Room for a Pony are all great breakfast places and just a short stroll away.",https://a0.muscache.com/pictures/a7ae8486-db36-4ba4-9632-2fcb64d9d3ff.jpg,153268,https://www.airbnb.com/users/show/153268,Yvette,2010-06-27,"Hobart, Australia","I am an adjunct Senior Lecturer at the School of Creative Arts & Media, University of Tasmania (and is fully vaccinated!)

Having felt like I was running an informal B&B for many years for friends and family, I  decided she may as well offer her home and hospitality to other travelers. I've been an AirBnB host for 12 years, and it has been a wonderful experience!

I am an artist, and animal advocate, and I love vegan cooking!",within an hour,100%,98%,t,https://a0.muscache.com/im/pictures/user/735f2b72-88c5-4aad-b243-5b1eadf90f33.jpg?aki_policy=profile_small,https://a0.muscache.com/im/pictures/user/735f2b72-88c5-4aad-b243-5b1eadf90f33.jpg?aki_policy=profile_x_medium,,3,3,"['email', 'phone', 'work_email']",t,t,Neighborhood highlights,Hobart,,-42.87895,147.31526,Private room in home,Private room,2,,1.5 shared baths,,,"[""Dishes and silverware"", ""TV"", ""Hangers"", ""Hair dryer"", ""Microwave"", ""Indoor fireplace"", ""Heating"", ""Shampoo"", ""Wifi"", ""Air conditioning"", ""Single level home"", ""Free street parking"", ""Cooking basics"", ""Coffee maker"", ""Dryer"", ""Oven"", ""Lockbox"", ""Washer"", ""Backyard"", ""Kitchen"", ""Patio or balcony"", ""Stove"", ""Self check-in"", ""Smoke alarm"", ""Dishwasher"", ""Refrigerator"", ""Essentials"", ""Iron"", ""Hot water""]",,1,7,1,1,7,7,1.0,7.0,,t,0,0,0,0,2024-09-05,255,0,0,2012-12-04,2020-03-08,4.82,4.87,4.82,4.96,4.96,4.81,4.9,Exempt: This listing falls under Section 12 of the Land Use Planning and Approvals Act 1993,f,3,2,1,0,1.78
1,84581,https://www.airbnb.com/rooms/84581,20240905032138,2024-09-05,city scrape,Kentisbury Country House Cradle Coast Tasmania,"Kentisbury Country House is a gorgeous, self catering rural retreat, ideal for romantic couples, families and groups of up to nine friends. A perfect base for exploring Cradle Mountain National Park and the North Coast of Tasmania. The house is entirely yours to enjoy","The European style house is situated on an acreage in the beautiful Kentish area with glorious views across rolling green fields towards Lake Barrington. Our guests enjoy hiking at Cradle Mountain, visiting the local vineyards, Anvers Chocolate Factory, Tasmazia, Ashgrove Cheese Factory, markets, galleries and the Outdoor Art Gallery town of Sheffield, famous for the murals. The coast is a half hour drive away and Mole Creek caves about the same distance.",https://a0.muscache.com/pictures/4899daf8-42fa-4a94-82e8-067a3d200e1d.jpg,461471,https://www.airbnb.com/users/show/461471,Melissa,2011-03-24,"Sheffield, Australia","Life revolves around family, food and operating our accommodation business. Favourite holiday destinations, apart from our beautiful piece of the world, are Northern Italy, South West of France and Norway. We love to stay in self contained cottages, preferably with some history attached.
Five things we can't live without- Our children and grandchildren, good fresh organic food, long walks, chocolate and our Silkie chickens!
 ",within an hour,100%,100%,t,https://a0.muscache.com/im/pictures/user/2676d4bb-15e0-4eec-b184-ff02d795040e.jpg?aki_policy=profile_small,https://a0.muscache.com/im/pictures/user/2676d4bb-15e0-4eec-b184-ff02d795040e.jpg?aki_policy=profile_x_medium,,1,1,"['email', 'phone']",t,t,Neighborhood highlights,Kentish,,-41.38892,146.23196,Entire home,Entire home/apt,9,2.0,2 baths,3.0,6.0,"[""Dishes and silverware"", ""Body soap"", ""Bathtub"", ""Valley view"", ""TV"", ""Outdoor dining area"", ""Clothing storage: closet"", ""Drying rack for clothing"", ""Hangers"", ""Hair dryer"", ""First aid kit"", ""Rice maker"", ""Coffee"", ""Microwave"", ""Private backyard \u2013 Not fully fenced"", ""Free parking on premises"", ""Cleaning products"", ""Shampoo"", ""Wifi"", ""Private entrance"", ""Garden view"", ""Outdoor furniture"", ""Barbecue utensils"", ""Extra pillows and blankets"", ""Toaster"", ""Fire extinguisher"", ""Cooking basics"", ""Free washer \u2013 In unit"", ""Dishwasher"", ""Oven"", ""Blender"", ""Shower gel"", ""Lake access"", ""Host greets you"", ""High chair"", ""Dining table"", ""Crib - available upon request"", ""Private patio or balcony"", ""Conditioner"", ""Mountain view"", ""Kitchen"", ""Hot water kettle"", ""BBQ grill"", ""Stove"", ""Bed linens"", ""Portable fans"", ""Radiant heating"", ""Smoke alarm"", ""Refrigerator"", ""Essentials"", ""Wine glasses"", ""Iron"", ""Hot water""]",$299.00,2,90,2,2,90,90,2.0,90.0,,t,27,48,65,293,2024-09-05,135,17,0,2015-12-18,2024-07-17,4.98,4.96,4.99,4.98,4.98,4.9,4.92,Exempt: This listing falls under Section 12 of the Land Use Planning and Approvals Act 1993,t,1,1,0,0,1.27
2,88873,https://www.airbnb.com/rooms/88873,20240905032138,2024-09-05,city scrape,Terrace- 5mins to central Hobart,A two storey 1880 terrace house.<br />Located in Hobart's CBD just mere minutes walking distance from the city's major cultural and gastronomic attractions including the historic precincts of Salamanca + Battery Point.,,https://a0.muscache.com/pictures/9a8e6e3e-e869-4066-885d-d49ca9b3d9d7.jpg,485048,https://www.airbnb.com/users/show/485048,Russell And Ingrid,2011-04-05,"Hobart, Australia","We're Russell and Ingrid.
Ingrid is a school music teacher and I teach at the Conservatorium of Music. We live on a small farm about an hour south of Hobart in the Huon Valley. We maintain our little house at 40 Goulburn Street where our guests make themselves at home....and hopefully enjoy their stay in Hobart.",within an hour,100%,96%,t,https://a0.muscache.com/im/users/485048/profile_pic/1343266601/original.jpg?aki_policy=profile_small,https://a0.muscache.com/im/users/485048/profile_pic/1343266601/original.jpg?aki_policy=profile_x_medium,,1,1,"['email', 'phone']",t,t,,Hobart,,-42.88219,147.32253,Entire townhouse,Entire home/apt,4,1.0,1 bath,2.0,3.0,"[""Dishes and silverware"", ""Bathtub"", ""Free washer"", ""Private hot tub"", ""TV"", ""Drying rack for clothing"", ""Hangers"", ""Hair dryer"", ""Rice maker"", ""Microwave"", ""Heating"", ""Cleaning products"", ""Shampoo"", ""Wifi"", ""Air conditioning"", ""Extra pillows and blankets"", ""Toaster"", ""Cooking basics"", ""Coffee maker"", ""Paid street parking off premises"", ""Oven"", ""Long term stays allowed"", ""Keypad"", ""Backyard"", ""Conditioner"", ""Kitchen"", ""Hot water kettle"", ""Stove"", ""Bed linens"", ""Self check-in"", ""Smoke alarm"", ""Wine glasses"", ""Refrigerator"", ""Essentials"", ""Iron"", ""Hot water""]",$125.00,2,365,2,2,365,365,2.0,365.0,,t,1,8,8,152,2024-09-05,617,57,3,2011-05-16,2024-08-19,4.67,4.77,4.77,4.93,4.87,4.87,4.75,Exempt: This listing falls under Section 12 of the Land Use Planning and Approvals Act 1993,f,1,1,0,0,3.81
3,137808,https://www.airbnb.com/rooms/137808,20240905032138,2024-09-05,city scrape,Bradman House CBD Launceston Invermay + Free WIFI,"Bradman House: Polished boards, modern kitchen, open-plan living. Two bedrooms with queen beds and bunks, spacious bathroom. Reverse cycle for comfort. Located in Forster Street, heart of Invermay, 1 km from Launceston City Centre, close to attractions. 2-bedroom home with amenities, self-service check-in/out. Access to the entire house, excluding the shed. Easy access from Launceston CBD, recommended to have a car. Keyless front door, entry/exit through the rear sliding door.","Bradman House is situated on the edge of Invermay's residential/semi industrial area. It is extremely easy to find, park and get in and out of Launceston CBD which is approx 1 km away.",https://a0.muscache.com/pictures/prohost-api/Hosting-137808/original/63f6eaee-e660-48f6-9a10-1346ece3f1be.jpeg,673625,https://www.airbnb.com/users/show/673625,Emma And Dale,2011-06-07,,,within an hour,100%,99%,f,https://a0.muscache.com/im/pictures/user/4610a24c-8594-40f8-8381-67bb3758ea0e.jpg?aki_policy=profile_small,https://a0.muscache.com/im/pictures/user/4610a24c-8594-40f8-8381-67bb3758ea0e.jpg?aki_policy=profile_x_medium,,2,5,"['email', 'phone', 'work_email']",t,t,Neighborhood highlights,Launceston,,-41.42548,147.12855,Entire home,Entire home/apt,9,2.0,2 baths,2.0,4.0,"[""Dishes and silverware"", ""TV"", ""Hangers"", ""Hair dryer"", ""Crib"", ""Microwave"", ""Heating"", ""Free parking on premises"", ""Shampoo"", ""Wifi"", ""Air conditioning"", ""Extra pillows and blankets"", ""Free street parking"", ""Cooking basics"", ""Oven"", ""Washer"", ""High chair"", ""Backyard"", ""Luggage dropoff allowed"", ""Ethernet connection"", ""Pets allowed"", ""Kitchen"", ""Iron"", ""Stove"", ""Bed linens"", ""Smoke alarm"", ""Refrigerator"", ""Essentials"", ""Fire extinguisher"", ""Hot water""]",$239.00,1,1125,1,1,1,1125,1.0,667.7,,t,22,38,60,311,2024-09-05,412,49,3,2012-02-14,2024-08-29,4.53,4.72,4.73,4.82,4.68,4.53,4.54,DA0518/2019,t,2,2,0,0,2.69
4,252996,https://www.airbnb.com/rooms/252996,20240905032138,2024-09-05,city scrape,Cosy Cabin @ Eagles Rise - Cradle Mountain 1 hour,"Welcome to Eagles Rise and the Cosy Cabin, with the comfiest bed on the North Central Coast I'm told! A new bed and mattress is awaiting your review!<br />The Cosy Cabin is a unit joined on to the main house but separated by a hall and two double doors giving complete privacy. <br />On the Eastern side is the cabin garden with a picnic table & bench seats and a cafe table & two chairs, as well as a Weber BBQ to use.<br />You are up in the peaceful rural hills of Gawler yet only 10 mins from town and the beach!","A beautiful rural pocket of hills and valleys, with fresh air and lots of greenery!<br />And yet only 10 minutes to the town and beach!<br /><br />Leven Canyon<br />Leven River Cruises with lunch<br />Gunns Plain Caves<br />Wing Wildlife Park<br />Lilico Beach Conservation Area, you will see Penguins from September to March.<br />Cradle Mountain and Dove Lake (80 km)<br />Narawntapu National Park (60 km)<br />Local Beaches - loads of them and mostly free of people!<br />Walking and cycling tracks<br />Vineyards<br />Turners Beach Berry Patch<br />Anvers Chocolate Factory<br />Mount Gnomon Farm<br />Penguin and the Sunday markets",https://a0.muscache.com/pictures/e01251ba-3fa7-4432-a06e-2c99af9c86f9.jpg,1090010,https://www.airbnb.com/users/show/1090010,Kit,2011-08-31,"Tasmania, Australia","From London originally, now living here in Tasmania.
Love animals, nature, art, music and reading philosophy.  Still working on my second book The CANdida CANcer CONnection. The title of my first book is 'The Irritable Brain Syndrome'.
Love breathing the beautiful fresh air here in Tasmania and listening the the many different birds that visit during the seasons of the year.  My favourites are the swallows that visit every year, building their nests, teaching their young to fly!  And the eagles that cruise around on the winds, high up in the sky. That's awesome to see :)
If you like wallabies, possums, echidnas and rabbits, there is plenty of them around dawn and dusk!  They seem to like my place and also the vegetation! I have to keep an eye on my vegetable patch :)
I am the proud owner and protector of an Irish Wolfhound puppy (who will be 8 years young at the end of June 2023) and I greatly enjoy sharing this time with this beautiful gentle giant! 
Tippi is her name :)
My motto?  'The only thing I know, is that all that I know, is only true in the moment that I know it'  kc  :)
Practice Truth, Compassion and Tolerance and this world will become a better place for yourself and all who meet you :)
And I look forward to meeting you! :)
Here's a few places to check out 'just around the corner'! :)
Leven Canyon
Gunns Plain Caves
Wing Wildlife Park
Lilico Beach Conservation Area, you will see Penguins from September to March.
Cradle Mountain and Dove Lake (80 km)
Narawntapu National Park (60 km)
Local Beaches - loads of them!
Walking and cycling tracks
Vineyards
Turners Beach Berry Patch
Anvers Chocolate Factory, and many more.
See you soon! :)
Kit Campbell",within an hour,100%,100%,t,https://a0.muscache.com/im/pictures/user/429f722a-5d2c-4395-b172-f888e15b3e41.jpg?aki_policy=profile_small,https://a0.muscache.com/im/pictures/user/429f722a-5d2c-4395-b172-f888e15b3e41.jpg?aki_policy=profile_x_medium,,2,3,"['email', 'phone', 'work_email']",t,t,Neighborhood highlights,Central Coast,,-41.2344,146.13398,Entire guest suite,Entire home/apt,2,1.0,1 bath,1.0,1.0,"[""Dishes and silverware"", ""Refrigerator"", ""Body soap"", ""Bathtub"", ""Indoor fireplace: wood-burning"", ""Fire pit"", ""Radiant heating"", ""Outdoor dining area"", ""Drying rack for clothing"", ""Hangers"", ""Board games"", ""Hair dryer"", ""First aid kit"", ""Coffee"", ""Microwave"", ""Cleaning products"", ""Shampoo"", ""Wifi"", ""Private entrance"", ""Garden view"", ""Private backyard \u2013 Fully fenced"", ""Outdoor furniture"", ""Barbecue utensils"", ""Extra pillows and blankets"", ""Single level home"", ""Free street parking"", ""Exterior security cameras on property"", ""Books and reading material"", ""Toaster"", ""Fire extinguisher"", ""Cooking basics"", ""Coffee maker"", ""Laundromat nearby"", ""Lockbox"", ""BBQ grill: gas"", ""Blender"", ""Long term stays allowed"", ""Dining table"", ""Kitchenette"", ""Conditioner"", ""Mini fridge"", ""Carbon monoxide alarm"", ""Beach essentials"", ""Paid dryer \u2013 In building"", ""Iron"", ""Hot water kettle"", ""Free driveway parking on premises \u2013 1 space"", ""Cleaning available during stay"", ""Bed linens"", ""Self check-in"", ""Portable fans"", ""Room-darkening shades"", ""32 inch TV"", ""Smoke alarm"", ""Essentials"", ""Wine glasses"", ""Clothing storage: dresser"", ""Hot water""]",$110.00,2,7,1,2,1125,1125,1.3,1125.0,,t,21,44,74,164,2024-09-05,81,7,1,2012-05-30,2024-09-03,4.91,4.94,4.94,4.91,4.95,4.83,4.89,Exempt: This listing falls under the 'home sharing' exemption,f,2,2,0,0,0.54
6,270374,https://www.airbnb.com/rooms/270374,20240905032138,2024-09-05,city scrape,Powerhouse Studio Eagles Rise - Cradle Mountn 1 hr,"NEW!!! A QUEEN BED IS NOW SITUATED DOWNSTAIRS - NO LOFT STAIRS! <br /><br />A comfortable 'New York Loft' style accommodation, with an industrial and contemporary feel.<br />As the host, I care about my guests and want to make sure they have everything they need, including information on what to see locally and the best places to eat etc.<br />Be here to relax, breathe and enjoy!<br />Welcome!","Uniqueness is as uniqueness does :)<br />Most of us in Tasmania, whether born here, or like me who travelled all the way from the other side of the world, create a colourful quilt that entertains, envelopes and draws you in.<br />I found my jewel of the world right here in Isandula, Tasmania.<br />Come, see and experience it for yourself :)<br />It's a place to lose your mind and re-discover your senses!<br />A beautiful rural pocket of hills and valleys, with fresh air and lots of greenery!<br />And yet only 10 minutes to the town and beach!<br /><br />Leven Canyon<br />Leven River Cruises with lunch<br />Gunns Plain Caves<br />Wing Wildlife Park<br />Lilico Beach Conservation Area, you will see Penguins from September to March.<br />Cradle Mountain and Dove Lake (80 km)<br />Narawntapu National Park (60 km)<br />Local Beaches - loads of them and mostly free of people!<br />Walking and cycling tracks<br />Vineyards<br />Turners Beach Berry Patch<br />Anvers Chocolate Factory<br />Moun",https://a0.muscache.com/pictures/hosting/Hosting-U3RheVN1cHBseUxpc3Rpbmc6MjcwMzc0/original/cb1bae5a-7fc3-4be4-825c-22dfd4973274.jpeg,1090010,https://www.airbnb.com/users/show/1090010,Kit,2011-08-31,"Tasmania, Australia","From London originally, now living here in Tasmania.
Love animals, nature, art, music and reading philosophy.  Still working on my second book The CANdida CANcer CONnection. The title of my first book is 'The Irritable Brain Syndrome'.
Love breathing the beautiful fresh air here in Tasmania and listening the the many different birds that visit during the seasons of the year.  My favourites are the swallows that visit every year, building their nests, teaching their young to fly!  And the eagles that cruise around on the winds, high up in the sky. That's awesome to see :)
If you like wallabies, possums, echidnas and rabbits, there is plenty of them around dawn and dusk!  They seem to like my place and also the vegetation! I have to keep an eye on my vegetable patch :)
I am the proud owner and protector of an Irish Wolfhound puppy (who will be 8 years young at the end of June 2023) and I greatly enjoy sharing this time with this beautiful gentle giant! 
Tippi is her name :)
My motto?  'The only thing I know, is that all that I know, is only true in the moment that I know it'  kc  :)
Practice Truth, Compassion and Tolerance and this world will become a better place for yourself and all who meet you :)
And I look forward to meeting you! :)
Here's a few places to check out 'just around the corner'! :)
Leven Canyon
Gunns Plain Caves
Wing Wildlife Park
Lilico Beach Conservation Area, you will see Penguins from September to March.
Cradle Mountain and Dove Lake (80 km)
Narawntapu National Park (60 km)
Local Beaches - loads of them!
Walking and cycling tracks
Vineyards
Turners Beach Berry Patch
Anvers Chocolate Factory, and many more.
See you soon! :)
Kit Campbell",within an hour,100%,100%,t,https://a0.muscache.com/im/pictures/user/429f722a-5d2c-4395-b172-f888e15b3e41.jpg?aki_policy=profile_small,https://a0.muscache.com/im/pictures/user/429f722a-5d2c-4395-b172-f888e15b3e41.jpg?aki_policy=profile_x_medium,,2,3,"['email', 'phone', 'work_email']",t,t,Neighborhood highlights,Central Coast,,-41.2344,146.134,Entire loft,Entire home/apt,3,1.0,1 bath,1.0,4.0,"[""Dishes and silverware"", ""Free washer \u2013 In building"", ""Body soap"", ""Indoor fireplace: wood-burning"", ""Fire pit"", ""Outdoor dining area"", ""Clothing storage: closet"", ""Drying rack for clothing"", ""Hangers"", ""Board games"", ""Argan Oil Conditioner & Shampoo conditioner"", ""Sun loungers"", ""Hair dryer"", ""First aid kit"", ""Rice maker"", ""Coffee"", ""Microwave"", ""Heating"", ""Free parking on premises"", ""Cleaning products"", ""Shampoo"", ""Wifi"", ""Private entrance"", ""Garden view"", ""Private backyard \u2013 Fully fenced"", ""Piano"", ""Park view"", ""Ceiling fan"", ""Barbecue utensils"", ""Extra pillows and blankets"", ""Courtyard view"", ""Free street parking"", ""Exterior security cameras on property"", ""Books and reading material"", ""Toaster"", ""Fire extinguisher"", ""Cooking basics"", ""Coffee maker"", ""Laundromat nearby"", ""55 inch HDTV"", ""Lockbox"", ""Blender"", ""Shower gel"", ""Long term stays allowed"", ""Dining table"", ""Kitchenette"", ""Central air conditioning"", ""Private patio or balcony"", ""Exercise equipment: free weights, yoga mat"", ""Mini fridge"", ""Carbon monoxide alarm"", ""Freezer"", ""Mountain view"", ""Hammock"", ""Paid dryer \u2013 In building"", ""Hot water kettle"", ""BBQ grill"", ""Cleaning available during stay"", ""Bed linens"", ""Self check-in"", ""Portable fans"", ""Room-darkening shades"", ""Smoke alarm"", ""Refrigerator"", ""Essentials"", ""Wine glasses"", ""Iron"", ""Hot water""]",$119.00,2,28,1,2,1125,1125,1.3,1125.0,,t,22,52,82,172,2024-09-05,85,2,0,2015-01-08,2024-01-10,4.96,4.99,4.99,4.99,5.0,4.94,4.88,Exempt: This listing falls under the 'home sharing' exemption,t,2,2,0,0,0.72
29,905873,https://www.airbnb.com/rooms/905873,20240905032138,2024-09-05,city scrape,Penfold Cottage CBD Launceston Invermay +freeWIFI,Penfold Cottage has 3 bedrooms with a queen and bunks in each room. It has an open living area with a reverse cycle system and oils heaters in each of the bedrooms. There is plenty of flat off street parking and a secure yard. Penfold has NBN Wifi.<br />All the queen sheets are supplied by a professional linen service and the remaining linen is laundered in our private commercial washer at 65 degrees. Our cleaners use commercial grade products.<br />Guests have access to the entire property.,"Penfold Cottage is located on the edge of Invermay's residential/semi industrial area. It is flat walking distance to launceston CBD, seaport, Aurora stadium and McDonalds.",https://a0.muscache.com/pictures/prohost-api/Hosting-905873/original/be621fbb-1eb2-4739-ac61-1e2dc70a2ed1.jpeg,673625,https://www.airbnb.com/users/show/673625,Emma And Dale,2011-06-07,,,within an hour,100%,99%,f,https://a0.muscache.com/im/pictures/user/4610a24c-8594-40f8-8381-67bb3758ea0e.jpg?aki_policy=profile_small,https://a0.muscache.com/im/pictures/user/4610a24c-8594-40f8-8381-67bb3758ea0e.jpg?aki_policy=profile_x_medium,,2,5,"['email', 'phone', 'work_email']",t,t,Neighborhood highlights,Launceston,,-41.42776,147.12824,Entire home,Entire home/apt,12,2.0,2 baths,3.0,5.0,"[""Dishes and silverware"", ""Body soap"", ""TV"", ""Hangers"", ""Hair dryer"", ""Microwave"", ""Heating"", ""Free parking on premises"", ""Cleaning products"", ""Shampoo"", ""Wifi"", ""Air conditioning"", ""Extra pillows and blankets"", ""Free street parking"", ""Fire extinguisher"", ""Cooking basics"", ""Oven"", ""Shower gel"", ""Washer"", ""High chair"", ""Crib - available upon request"", ""Backyard"", ""Conditioner"", ""Luggage dropoff allowed"", ""Pets allowed"", ""Kitchen"", ""Stove"", ""Bed linens"", ""Smoke alarm"", ""Refrigerator"", ""Essentials"", ""Iron"", ""Hot water""]",$239.00,1,1125,1,1,1,1125,1.0,673.3,,t,23,42,61,319,2024-09-05,451,55,3,2013-02-18,2024-09-04,4.59,4.77,4.71,4.83,4.64,4.57,4.63,BA0504/2916,t,2,2,0,0,3.21
