84,2079819,https://www.airbnb.com/rooms/2079819,20240905032138,2024-09-05,city scrape,1950s 2BR Bicheno Holiday Cottage,Our 2BR cottage is perfectly located in Bicheno - 10 mins walk to both family friendly and great surf beaches. Only a 35min drive to Freycinet National Park and Wineglass bay. Great for couples or families exploring the East Coast or simply chilling,"Bicheno has one of the mildest climates in Tasmania and is perfectly located to explore the East Coast or simply relax and enjoy what the town has to offer.<br /><br />It's about 2 hours drive from Launceston, 2.5 hours from Hobart and 35 minutes from Freycinet National Park, Coles Bay and the famous Wineglass Bay. It's only about 15mins from the Douglas Apsley National Park which features a perfect water hole for swimming on a hot day.<br /><br />We are also only about 40 mins from St Helens and Bay of Fires - the drive both north and south of Bicheno is amongst the most scenic routes in Tasmania.<br /><br />It's also great for food lovers with summer berries, fresh fish, oysters, crayfish, wine, and several nice places to eat out all within easy access.<br /><br />Bicheno is a small town but with great facilities including, an excellent bakery, an amazing fresh fish shop that also does great F'nC's, nice cafes and restaurants, a golf course and a lawn bowls and petanque club.<br /><b",https://a0.muscache.com/pictures/ef12db89-d3af-4115-8d4e-366182d3dc62.jpg,10625331,https://www.airbnb.com/users/show/10625331,Melissa,2013-12-14,"Castlemaine, Australia","Greetings! We get down to Bicheno a couple of times a year, but we really want others to come and enjoy it! Bicheno and surrounds  have alot to offer but you can also do nothing but read or watch or play when you stay at Moonya! It is toasty warm when the fire is on, so even in the cooler months relaxation is to be had. Come, Enjoy, Relax! Melissa",within an hour,100%,98%,f,https://a0.muscache.com/im/users/10625331/profile_pic/1390216418/original.jpg?aki_policy=profile_small,https://a0.muscache.com/im/users/10625331/profile_pic/1390216418/original.jpg?aki_policy=profile_x_medium,,1,1,"['email', 'phone']",t,t,Neighborhood highlights,Glamorgan/Spring Bay,,-41.87254,148.28723,Entire home,Entire home/apt,5,1.0,1 bath,2.0,4.0,"[""Dishes and silverware"", ""Refrigerator"", ""TV"", ""Children\u2019s books and toys"", ""Microwave"", ""Indoor fireplace"", ""Heating"", ""Free parking on premises"", ""Cooking basics"", ""Washer"", ""High chair"", ""Backyard"", ""Kitchen"", ""Patio or balcony"", ""Stove"", ""Children\u2019s dinnerware"", ""Smoke alarm"", ""Oven"", ""Hot water""]",$120.00,3,1125,3,3,1125,1125,3.0,1125.0,,t,21,35,43,248,2024-09-05,231,31,0,2014-01-29,2024-07-13,4.75,4.84,4.55,4.87,4.84,4.86,4.76,Exempt: This listing falls under Section 12 of the Land Use Planning and Approvals Act 1993,f,1,1,0,0,1.79
573,12214074,https://www.airbnb.com/rooms/12214074,20240905032138,2024-09-05,city scrape,Modern Studio with parking,This beautiful and private studio has everything you could need for your stay in Hobart.  Situated beside our house but completely seperate and private.  Set in lovely garden grounds with well equipt kitchen and bathroom.  Off street parking as well.,New Town is a short drive to the city as well as Salamanca Place.  It is also a short drive to MONA.  Our property is set back from the street; both central and surprisingly quiet.,https://a0.muscache.com/pictures/bffc4d95-6ecf-46fb-8395-bab77941e74b.jpg,65697710,https://www.airbnb.com/users/show/65697710,Melissa,2016-04-04,"Newtown, Australia","I'm in my forties and have two gorgeous children.  We love holidays together but I also enjoy time at home. We are considerate guests and friendly, helpful hosts.  When on holiday we love to be by the sea where the children can boogie board and play on the beach as well as bike ride and the adults can enjoy a glass of wine in the evening! We enjoy travelling with friends as well.  As a host it's been nice to meet people and it is rewarding when they are so grateful for our help and advice!  ",within an hour,100%,100%,t,https://a0.muscache.com/im/pictures/user/054c0e62-2a0c-4ea5-8b7b-5c61bf0b666c.jpg?aki_policy=profile_small,https://a0.muscache.com/im/pictures/user/054c0e62-2a0c-4ea5-8b7b-5c61bf0b666c.jpg?aki_policy=profile_x_medium,,1,1,"['email', 'phone']",t,t,Neighborhood highlights,Hobart,,-42.85178,147.30938,Entire guesthouse,Entire home/apt,4,1.0,1 bath,0.0,2.0,"[""Dishes and silverware"", ""TV"", ""Hangers"", ""Children\u2019s books and toys"", ""Hair dryer"", ""Heating"", ""Free parking on premises"", ""Shampoo"", ""Wifi"", ""Air conditioning"", ""Dryer"", ""Oven"", ""Lockbox"", ""Washer"", ""Backyard"", ""Kitchen"", ""Iron"", ""Stove"", ""Children\u2019s dinnerware"", ""Self check-in"", ""Smoke alarm"", ""Refrigerator"", ""Essentials"", ""Fire extinguisher""]",$150.00,2,1125,2,2,1125,1125,2.0,1125.0,,t,26,39,40,101,2024-09-05,144,18,0,2016-04-20,2024-07-27,4.92,4.91,4.94,4.95,4.96,4.84,4.89,Exempt: This listing falls under the 'home sharing' exemption,t,1,1,0,0,1.41
748,15535209,https://www.airbnb.com/rooms/15535209,20240905032138,2024-09-05,city scrape,Ensuite room with deck in family home.,"Do you like a bit of 'dayspa vibes' but also goofy kids welcoming you? <br /><br />Need a convenient ensuite room near Launceston with bus stop/off street parking? <br /><br />Ok with sharing the kitchen & open deck?<br /><br />I'll be honest, this is a family home so although we will respect your privacy you may be welcomed as part of our family with sily jokes, pounced on by a friendly toy poodle or asked questions like your favourite colour or Nintendo game.<br /><br />Non-dodgy people only. <br />Women or couples preferred.",,https://a0.muscache.com/pictures/hosting/Hosting-15535209/original/404b3206-e2f5-4860-8482-fe7a1208fb2a.jpeg,32943507,https://www.airbnb.com/users/show/32943507,Melissa,2015-05-09,"Launceston, Australia","Widowed mother of 3 young busy boys.
Follower of Jesus.
Art Therapy Student.
Creator of many creations.
Garden lover.
Reflexologist.",,,56%,f,https://a0.muscache.com/im/pictures/user/User-32943507/original/79134a3f-0eb4-4575-ae53-326d5e562594.jpeg?aki_policy=profile_small,https://a0.muscache.com/im/pictures/user/User-32943507/original/79134a3f-0eb4-4575-ae53-326d5e562594.jpeg?aki_policy=profile_x_medium,,1,1,"['email', 'phone']",t,t,,West Tamar,,-41.3987,147.08853,Private room in home,Private room,2,1.0,1 bath,1.0,1.0,"[""Shared backyard"", ""Body soap"", ""Bathtub"", ""Free parking on premises"", ""Private entrance"", ""Kitchen"", ""Patio or balcony"", ""Outdoor dining area"", ""BBQ grill"", ""Washer"", ""Hangers"", ""Bed linens"", ""Barbecue utensils"", ""Dining table"", ""Smoke alarm"", ""Room-darkening shades"", ""Lock on bedroom door""]",$66.00,1,365,1,1,365,365,1.0,365.0,,t,0,0,0,1,2024-09-05,5,5,0,2024-01-26,2024-03-11,5.0,5.0,5.0,5.0,5.0,5.0,5.0,Exempt: This listing falls under the 'home sharing' exemption,f,1,0,1,0,0.67
1196,20959980,https://www.airbnb.com/rooms/20959980,20240905032138,2024-09-05,city scrape,West Hobart Historic Cottage 🌈 🌱 🏳️‍⚧️,"On occasions when I'm away I offer my home for AirBnBers.  Your bedroom is only used for guests, and is all set up for your comfort. <br /><br />Please note that there will most likely be guests in my other listing, the ""The Cave"", which is a self-contained apartment on the lower level (basement) of the house.","This part of West Hobart is heritage listed and one of the oldest parts of Hobart. It is very central, being on the edge of the CBD. There are many cafes, bars and restaurants nearby, with the cafe/restaurant strip in Elizabeth Street North Hobart a short walk away, and Salamanca a 20 minute walk. Smolt Kitchen cafe is very close by, and Pigeon Hole and Room for a Pony are both close by and recommended for breakfast. and the renowned Hill Street Grocer is a 5 minute walk away for quality food. They also have pre-prepared meals to heat and eat.",https://a0.muscache.com/pictures/b6dfaf34-c36b-45b9-a570-d6cc1fd0604f.jpg,153268,https://www.airbnb.com/users/show/153268,Yvette,2010-06-27,"Hobart, Australia","I am an adjunct Senior Lecturer at the School of Creative Arts & Media, University of Tasmania (and is fully vaccinated!)

Having felt like I was running an informal B&B for many years for friends and family, I  decided she may as well offer her home and hospitality to other travelers. I've been an AirBnB host for 12 years, and it has been a wonderful experience!

I am an artist, and animal advocate, and I love vegan cooking!",within an hour,100%,98%,t,https://a0.muscache.com/im/pictures/user/735f2b72-88c5-4aad-b243-5b1eadf90f33.jpg?aki_policy=profile_small,https://a0.muscache.com/im/pictures/user/735f2b72-88c5-4aad-b243-5b1eadf90f33.jpg?aki_policy=profile_x_medium,,3,3,"['email', 'phone', 'work_email']",t,t,Neighborhood highlights,Hobart,,-42.87916,147.31529,Entire home,Entire home/apt,2,1.5,1.5 baths,1.0,1.0,"[""Dishes and silverware"", ""Bathtub"", ""TV"", ""Drying rack for clothing"", ""Hangers"", ""Sound system"", ""Hair dryer"", ""First aid kit"", ""Rice maker"", ""Coffee"", ""Microwave"", ""Indoor fireplace"", ""Heating"", ""Cleaning products"", ""Shampoo"", ""City skyline view"", ""Record player"", ""Wifi"", ""Air conditioning"", ""Private entrance"", ""Outdoor furniture"", ""Extra pillows and blankets"", ""Free street parking"", ""Toaster"", ""Cooking basics"", ""Coffee maker"", ""Dryer"", ""Oven"", ""Lockbox"", ""Clothing storage: wardrobe"", ""Blender"", ""Shower gel"", ""Washer"", ""High chair"", ""Dining table"", ""Private patio or balcony"", ""Backyard"", ""Conditioner"", ""Freezer"", ""Baking sheet"", ""Luggage dropoff allowed"", ""Kitchen"", ""Hot water kettle"", ""Stove"", ""Bed linens"", ""Self check-in"", ""Smoke alarm"", ""Room-darkening shades"", ""Dishwasher"", ""Refrigerator"", ""Essentials"", ""Wine glasses"", ""Iron"", ""Hot water""]",$113.00,2,14,1,2,14,14,2.0,14.0,,t,1,1,1,1,2024-09-05,63,16,0,2017-12-31,2024-07-28,4.98,5.0,4.9,5.0,5.0,4.98,4.97,Exempt: This listing falls under the 'home sharing' exemption,f,3,2,1,0,0.77
2287,35398422,https://www.airbnb.com/rooms/35398422,20240905032138,2024-09-05,city scrape,"""The Cave"" West Hobart 🌈 🌱 🏳️‍⚧️","""The Cave"" is a stylish and unique self-contained apartment under my centrally located 1885 West Hobart home. It is a 15 minute walk to the city centre and a short walk to the Elizabeth Street North Hobart cafe strip.<br /><br />With the stairs to the entry and the bed in a raised platform ""nook"", ""The Cave"" may not be for everyone, but if you're looking for well located lodgings that ooze atmosphere I think you'll love it!","This part of West Hobart is heritage listed and one of the oldest parts of Hobart. It is very central, being on the edge of the CBD. <br /><br />There are many cafes, bars and restaurants nearby, with the cafe/restaurant strip in Elizabeth Street North Hobart a short walk away, and Salamanca a 20 minute walk. The renowned Hill Street Grocer is a 5 - 7 minute walk away if you want to stock up on quality food stuffs (they also sell prepared heat-and-eat meals), and Smolt Kitchen, Pigeon hole Bakery/Cafe, & Room for a Pony are all great breakfast places and just a short stroll away.<br /><br />If you feel like a bush walk, Knocklofty Reserve is also close by and there are numerous walking trails there (it's a very short drive or about a 20 minute walk to the bush).",https://a0.muscache.com/pictures/miso/Hosting-35398422/original/beeb46cf-50d8-45aa-a03d-fc89b12988f1.jpeg,153268,https://www.airbnb.com/users/show/153268,Yvette,2010-06-27,"Hobart, Australia","I am an adjunct Senior Lecturer at the School of Creative Arts & Media, University of Tasmania (and is fully vaccinated!)

Having felt like I was running an informal B&B for many years for friends and family, I  decided she may as well offer her home and hospitality to other travelers. I've been an AirBnB host for 12 years, and it has been a wonderful experience!

I am an artist, and animal advocate, and I love vegan cooking!",within an hour,100%,98%,t,https://a0.muscache.com/im/pictures/user/735f2b72-88c5-4aad-b243-5b1eadf90f33.jpg?aki_policy=profile_small,https://a0.muscache.com/im/pictures/user/735f2b72-88c5-4aad-b243-5b1eadf90f33.jpg?aki_policy=profile_x_medium,,3,3,"['email', 'phone', 'work_email']",t,t,Neighborhood highlights,Hobart,,-42.87999,147.31448,Entire rental unit,Entire home/apt,3,1.0,1 bath,1.0,1.0,"[""Dishes and silverware"", ""Bathtub"", ""Free dryer \u2013 In building"", ""Free washer"", ""TV"", ""Outdoor dining area"", ""Drying rack for clothing"", ""Hangers"", ""Hair dryer"", ""First aid kit"", ""Coffee"", ""Microwave"", ""Heating"", ""Cleaning products"", ""Shampoo"", ""City skyline view"", ""Wifi"", ""Garden view"", ""Private entrance"", ""Outdoor furniture"", ""Coffee maker: french press, Nespresso"", ""Bluetooth sound system"", ""Extra pillows and blankets"", ""Free street parking"", ""Books and reading material"", ""Toaster"", ""Fire extinguisher"", ""Cooking basics"", ""Oven"", ""Lockbox"", ""Blender"", ""Shower gel"", ""Long term stays allowed"", ""Dining table"", ""Central air conditioning"", ""Private patio or balcony"", ""Conditioner"", ""Breakfast"", ""Mini fridge"", ""Carbon monoxide alarm"", ""Freezer"", ""Clothing storage"", ""Baking sheet"", ""Luggage dropoff allowed"", ""Pets allowed"", ""Kitchen"", ""Hot water kettle"", ""Stove"", ""Bed linens"", ""Self check-in"", ""Smoke alarm"", ""Room-darkening shades"", ""Dishwasher"", ""Refrigerator"", ""Essentials"", ""Wine glasses"", ""Shared backyard \u2013 Fully fenced"", ""Iron"", ""Hot water""]",$112.00,1,300,2,4,1125,1125,3.4,1125.0,,t,9,33,59,142,2024-09-05,364,55,4,2019-06-10,2024-09-01,4.94,4.96,4.95,4.99,4.98,4.92,4.93,Exempt: This listing falls under the 'home sharing' exemption,f,3,2,1,0,5.7
2503,39564982,https://www.airbnb.com/rooms/39564982,20240905032138,2024-09-05,city scrape,Deluxe Exclusive Retro Retreat,,Exclusive Suburb,https://a0.muscache.com/pictures/c8c9dbb3-0ac4-464d-89a2-f3edba30e257.jpg,77163675,https://www.airbnb.com/users/show/77163675,Melissa,2016-06-11,"Rock Hall, MD",,,,,f,https://a0.muscache.com/im/pictures/user/dd0521f3-b5eb-4402-8a39-781f8cb4571c.jpg?aki_policy=profile_small,https://a0.muscache.com/im/pictures/user/dd0521f3-b5eb-4402-8a39-781f8cb4571c.jpg?aki_policy=profile_x_medium,,1,3,"['email', 'phone']",t,t,Neighborhood highlights,Launceston,,-41.4546834,147.1333666,Entire home,Entire home/apt,4,1.0,1 bath,2.0,2.0,"[""Dishes and silverware"", ""Bathtub"", ""Vineyard view"", ""Valley view"", ""Free washer"", ""Outdoor dining area"", ""Drying rack for clothing"", ""Hangers"", ""Stainless steel oven"", ""Hair dryer"", ""First aid kit"", ""Theme room"", ""Coffee"", ""Microwave"", ""40 inch HDTV with Chromecast, DVD player"", ""Indoor fireplace: electric"", ""AC - split type ductless system"", ""Private backyard \u2013 Not fully fenced"", ""Cleaning products"", ""Wifi"", ""City skyline view"", ""Private entrance"", ""Garden view"", ""Outdoor furniture"", ""Park view"", ""Barbecue utensils"", ""Extra pillows and blankets"", ""Courtyard view"", ""Single level home"", ""Imperial Leather  body soap"", ""Exterior security cameras on property"", ""Books and reading material"", ""Toaster"", ""Heating - split type ductless system"", ""Fire extinguisher"", ""Cooking basics"", ""River view"", ""Shower gel"", ""Boutique  conditioner"", ""Long term stays allowed"", ""Dining table"", ""Free driveway parking on premises"", ""Private patio or balcony"", ""Resort view"", ""Pocket wifi"", ""Mini fridge"", ""Freezer"", ""Mountain view"", ""Baking sheet"", ""Luggage dropoff allowed"", ""Beach essentials"", ""Kitchen"", ""Hot water kettle"", ""BBQ grill"", ""Cleaning available during stay"", ""Bed linens"", ""Electric stove"", ""Portable fans"", ""Room-darkening shades"", ""Smoke alarm"", ""Refrigerator"", ""Essentials"", ""Wine glasses"", ""Iron"", ""Hot water"", ""Boutique  shampoo""]",$194.00,7,1125,7,7,1125,1125,7.0,1125.0,,,23,53,83,83,2024-09-05,0,0,0,,,,,,,,,,,f,1,1,0,0,
2930,45675970,https://www.airbnb.com/rooms/45675970,20240905032138,2024-09-05,city scrape,Hideaway@Acton - a rustic cabin hidden in the bush,"Ready for a bush hideaway? Hideaway@Acton is a rustic wood cabin located at the rear of my 2.5 acre property in Acton Park.    A feature of the cabin is the 'window wall' giving you uninterrupted views of the bushland, eucalyptus trees and the bird and animal life ! The property features one bedroom with ensuite bathroom and an open plan living space incorporating a kitchenette, dining and lounge area with sofabed.   Open the sliding door to a deck, the perfect spot to take in your surroundings!","Acton Park is a semi-rural residential area, with most homes on acreage making it very private and peaceful.  The nearest shops are 5 minutes away (by car) in Lauderdale where you will find a small supermarket, chemist, newsagent, bottle shop and tavern, takeaway and coffee shops a 5  in Lauderdale.  Seven Mile and Roches Beach are a 5 minute drive, perfect spots for a swim or a beach walk.   Acton Park is conveniently located, approximately 15- 20 minutes to the heart of Hobart by car and a 10-15 minute drive to the Airport.",https://a0.muscache.com/pictures/hosting/Hosting-45675970/original/eb786d4e-9f9c-4898-af84-02d865cee8f6.jpeg,370049231,https://www.airbnb.com/users/show/370049231,Melissa,2020-09-30,"Acton Park, Australia","Greetings to you and thanks for taking the time to delve a little more into my listing and profile.  I am truly blessed to live in the bushland environment that I do, with my 3 children, two dogs, a cat and chooks and the abundant wildlife that I share the land with. 

I love getting outdoors, whether it's working at home, walking the dogs or going bushwalking in our beautiful national parks.  I enjoy a regular yoga practice and continue to put myself out of my comfort zone by training with a karate group, ....... who said ""you can't teach an old dog new tricks"" !!!!

Tasmania has so many ""hidden gems"" to discover and I hope to spend more time travelling locally in the next few years.  I'm Tasmanian-born but continue to be amazed by what I've not seen before then stumble across.    When the time is right I'd love to head overseas again,  for another European adventure or trek the Inca Trail to Machu Picchu.

Tread lightly and travel safe on your journey,

Melissa







",within an hour,100%,100%,t,https://a0.muscache.com/im/pictures/user/User-370049231/original/bfcfd478-844f-4053-b703-c8a178b0614a.jpeg?aki_policy=profile_small,https://a0.muscache.com/im/pictures/user/User-370049231/original/bfcfd478-844f-4053-b703-c8a178b0614a.jpeg?aki_policy=profile_x_medium,,1,1,"['email', 'phone']",t,t,Neighborhood highlights,Clarence,,-42.876961,147.470596,Entire cabin,Entire home/apt,3,1.0,1 bath,1.0,3.0,"[""Dishes and silverware"", ""Body soap"", ""Baby bath - always at the listing"", ""Self check-in"", ""TV"", ""Smoking allowed"", ""Drying rack for clothing"", ""Hangers"", ""Board games"", ""Sound system"", ""Hair dryer"", ""Folding or convertible high chair - always at the listing"", ""First aid kit"", ""Shared backyard \u2013 Fully fenced"", ""Central heating"", ""Coffee"", ""Microwave"", ""Free parking on premises"", ""Cleaning products"", ""Shampoo"", ""Record player"", ""Wifi"", ""Garden view"", ""Pack \u2019n play/Travel crib - always at the listing"", ""2 burner convection hotplate electric stove"", ""Private entrance"", ""Outdoor furniture"", ""Extra pillows and blankets"", ""Single level home"", ""Free street parking"", ""Books and reading material"", ""Toaster"", ""Fire extinguisher"", ""Cooking basics"", ""Laundromat nearby"", ""Lockbox"", ""Clothing storage: wardrobe"", ""Shower gel"", ""Long term stays allowed"", ""Crib - always at the listing"", ""Dining table"", ""Central air conditioning"", ""Private patio or balcony"", ""Conditioner"", ""Breakfast"", ""Mini fridge"", ""Carbon monoxide alarm"", ""Outlet covers"", ""Freezer"", ""Air Fryer oven"", ""Luggage dropoff allowed"", ""Beach essentials"", ""Kitchen"", ""Hot water kettle"", ""Children\u2019s books and toys for ages 0-2 years old and 2-5 years old"", ""Bed linens"", ""Children\u2019s dinnerware"", ""Baby monitor - available upon request"", ""Changing table - always at the listing"", ""Room-darkening shades"", ""Smoke alarm"", ""Refrigerator"", ""Essentials"", ""Wine glasses"", ""Shared beach access"", ""Iron"", ""Hot water"", ""Babysitter recommendations""]",$140.00,2,1125,2,2,1125,1125,2.0,1125.0,,t,0,12,20,149,2024-09-05,69,25,3,2020-12-14,2024-08-24,4.99,4.96,4.94,4.99,4.99,4.97,4.93,Exempt: This listing falls under the 'home sharing' exemption,f,1,1,0,0,1.52
3163,48875071,https://www.airbnb.com/rooms/48875071,20240905032138,2024-09-05,city scrape,Families Groups & Couples ~ Fresh Coastal Shack,"'Sisters Beach Stay' is situated across the road, just a stone's throw from beautiful Sisters Beach. <br /><br />Our 2 story stay is a modern version of the coastal shack - part shack and part home away from home. <br />We are a no-top-sheet kind of getaway, so you won't find ironed covers here; we embrace quirky with crinkles and a clean, fresh feel with a relaxed fit.","The village of Sisters Beach is enveloped on all sides by the spectacular Rocky Cape National Park. <br />Residents and visitors come here to enjoy the relaxed peaceful lifestyle, the unspoiled beaches, clear unpolluted waters, stunning coastal scenery, and secluded bush land. Take some time to stroll this long stretch of unspoiled beach, and marvel in the moody rock formations, powdery white sand and dark copper coloured tea tree water of Sisters Creek that flows into the ocean near your Stay.<br /><br />Bushwalking, trekking or tramping (depending on where you come from),  is one of the best ways to experience the beauty of nature, first hand. Using Sisters Beach Stays as your home base, you can adventure far and wide in a day and still enjoy the cosiness of the wood heater followed by a hot shower and a warm bed to soothe your weary bones at the end of the day. <br /><br />Road trip for the day or stay and explore our local region. We are more than happy to assist with recommendatio",https://a0.muscache.com/pictures/34af5dd3-3903-46a9-8bc2-3c9311c6e4d1.jpg,98979781,https://www.airbnb.com/users/show/98979781,Melissa,2016-10-09,"Wynyard, Australia","Hi! 

I am Founder/Lead Facilitator of Leading Rein, an award-winning concept, integrating ground based leadership learnings alongside horses. 

Hosting workshops and retreats for businesses to build conscious leadership through communication and relationship skills.

I am 2023 Tas Winner- Agrifutures Rural Women’s Award

NW coast Tasmania",within an hour,100%,97%,t,https://a0.muscache.com/im/pictures/user/User-98979781/original/5ccd0316-d937-4839-be8b-b819536bd864.jpeg?aki_policy=profile_small,https://a0.muscache.com/im/pictures/user/User-98979781/original/5ccd0316-d937-4839-be8b-b819536bd864.jpeg?aki_policy=profile_x_medium,,1,1,"['email', 'phone']",t,t,Neighborhood highlights,Waratah/Wynyard,,-40.91525,145.55664,Entire home,Entire home/apt,6,1.0,1 bath,3.0,3.0,"[""Dishes and silverware"", ""Free washer \u2013 In building"", ""Body soap"", ""Free dryer \u2013 In building"", ""Indoor fireplace: wood-burning"", ""Fire pit"", ""Outdoor dining area"", ""Drying rack for clothing"", ""Children\u2019s books and toys"", ""Board games"", ""Sound system"", ""Sun loungers"", ""Hair dryer"", ""First aid kit"", ""Game console: Nintendo Wii"", ""Coffee"", ""Children\u2019s bikes"", ""Microwave"", ""Private backyard \u2013 Not fully fenced"", ""Free parking on premises"", ""Cleaning products"", ""Shampoo"", ""Wifi"", ""Private entrance"", ""Outdoor furniture"", ""Boat slip"", ""Fireplace guards"", ""Barbecue utensils"", ""Extra pillows and blankets"", ""Bikes"", ""Coffee maker: espresso machine"", ""Books and reading material"", ""Toaster"", ""Fire extinguisher"", ""Cooking basics"", ""Other stainless steel wood-burning stove"", ""Oven"", ""BBQ grill: gas"", ""Lockbox"", ""Kayak"", ""Dining table"", ""Private patio or balcony"", ""Conditioner"", ""HDTV with Netflix"", ""Freezer"", ""Clothing storage"", ""Dedicated workspace"", ""Baking sheet"", ""Hammock"", ""Kitchen"", ""Hot water kettle"", ""Bed linens"", ""Children\u2019s dinnerware"", ""Self check-in"", ""Smoke alarm"", ""Radiant heating"", ""Wine glasses"", ""Refrigerator"", ""Essentials"", ""Shared beach access"", ""Iron"", ""Hot water""]",$258.00,2,30,2,2,1125,1125,2.0,1125.0,,t,23,49,70,296,2024-09-05,68,19,0,2021-07-07,2024-07-15,4.91,4.85,4.79,4.9,4.93,4.97,4.84,DA 63/2021,f,1,1,0,0,1.76
