3526,53172846,https://www.airbnb.com/rooms/53172846,20240905032138,2024-09-05,city scrape,Luxe cottage in the heart of Sandy Bay,"Unwind in style with the luxe furnishings and newly renovated interior of this 3 bedroom cottage only a stones' throw from the Sandy Bay shopping precinct. Professionally styled and kitted out with all the essentials to have a relaxing stay in Hobart. The cottage features 3 bedrooms each with a queen bed, an outdoor area for relaxing in and off-street car parking.","Positioned in the heart of Sandy Bay you will find Woolworths, bakeries, the post office, boutiques, cafes and more all on your doorstep. <br /><br />The foreshore of the Derwent River is only 5 minutes walk and you can reach the CBD or Battery Point in around 10-15 mins on foot. <br /><br />Super convenient and easy access to all of what Hobart has to offer, you can either walk or take public transport/Uber if you choose not to drive.",https://a0.muscache.com/pictures/miso/Hosting-53172846/original/01019a94-07c7-4135-8590-6a33e8c0c83f.jpeg,429481481,https://www.airbnb.com/users/show/429481481,Melissa,2021-10-29,,,within an hour,100%,98%,t,https://a0.muscache.com/im/pictures/user/01421d9d-405e-446d-b97e-ded0d24788ee.jpg?aki_policy=profile_small,https://a0.muscache.com/im/pictures/user/01421d9d-405e-446d-b97e-ded0d24788ee.jpg?aki_policy=profile_x_medium,,1,1,['phone'],t,t,Neighborhood highlights,Hobart,,-42.89446,147.32811,Entire home,Entire home/apt,6,1.0,1 bath,3.0,3.0,"[""Dishes and silverware"", ""TV"", ""Outdoor dining area"", ""Coffee maker: Nespresso"", ""Drying rack for clothing"", ""Hangers"", ""Hair dryer"", ""First aid kit"", ""Microwave"", ""Heating"", ""Shampoo"", ""Wifi"", ""Private entrance"", ""Extra pillows and blankets"", ""Single level home"", ""Free street parking"", ""Cooking basics"", ""Dryer"", ""Oven"", ""Lockbox"", ""Free residential garage on premises"", ""Washer"", ""Indoor fireplace: gas"", ""Private patio or balcony"", ""Backyard"", ""Kitchen"", ""Iron"", ""Stove"", ""Bed linens"", ""Self check-in"", ""Smoke alarm"", ""Room-darkening shades"", ""Dishwasher"", ""Refrigerator"", ""Essentials"", ""Fire extinguisher"", ""Hot water""]",$249.00,2,365,2,2,365,365,2.0,365.0,,t,21,43,65,144,2024-09-05,154,39,2,2021-11-28,2024-08-18,4.89,4.94,4.78,4.99,4.9,4.97,4.75,PLN-21-672,t,1,1,0,0,4.56
3700,557441650538446713,https://www.airbnb.com/rooms/557441650538446713,20240905032138,2024-09-05,city scrape,The Lazy Prospector. Central Wilderness Stay for 2,"An ideal central base to explore Tasmania’s rugged west coast, and the perfect place for you and your special someone to relax after a day of hiking, biking or sightseeing. <br /><br />Whether it’s the deep soak bath, lounging in front of the wood fire heater, or relaxing on the daybed while taking in the mountain views, special memories are made here.<br /><br />The Lazy Prospector, featured in Broadsheet and Qantas Insider, welcomes guests of all communities and backgrounds.","The West Coast is as rugged, magnificent, and photogenic as it is soothing to the soul. <br /><br />Zeehan, where The Lazy Prospector is located, has a rich and colourful history. Once known as The Silver City, in the early 1900s, it was home to 10,000 people and a bustling mining community. At the time, it was the third largest town in Tasmania. <br /><br />Today, the faded glamour of these heady days is captured by the hauntingly beautiful grand buildings lining the main street, while a grittiness, remnant of its mining days, is evident throughout. The hauntingly beautiful Main Street can,  at times, feel like a modern day ghost town. <br /><br />Zeehan is central to all the west coast towns:<br /><br />- Queenstown (30 mins drive) home to the Westcoast Wilderness Railway, Empire Hotel and the contemporary Q Bank Gallery; <br /><br />- Rosebery (20 mins drive) a working mining town where you’ll discover Montezuma Falls;<br /><br />-Tullah (30 mins drive) with its walking tracks and b",https://a0.muscache.com/pictures/hosting/Hosting-557441650538446713/original/aa8a72e3-9a03-4bf2-b554-30bb073622eb.jpeg,74942973,https://www.airbnb.com/users/show/74942973,Melissa,2016-05-31,,"Loving the serenity of coastal-country living in the Northern Rivers of NSW with my husband, two daughters and a colourful menagerie. ",within an hour,100%,100%,t,https://a0.muscache.com/im/pictures/user/a89eefb6-033e-48b9-9003-94c4d3b59b07.jpg?aki_policy=profile_small,https://a0.muscache.com/im/pictures/user/a89eefb6-033e-48b9-9003-94c4d3b59b07.jpg?aki_policy=profile_x_medium,,1,1,"['email', 'phone']",t,t,Neighborhood highlights,West Coast,,-41.88837,145.34384,Entire cabin,Entire home/apt,2,1.0,1 bath,1.0,1.0,"[""Dishes and silverware"", ""Free washer \u2013 In building"", ""Bathtub"", ""Free dryer \u2013 In building"", ""Outdoor dining area"", ""Drying rack for clothing"", ""Hangers"", ""Hair dryer"", ""Portable heater"", ""First aid kit"", ""Coffee"", ""Microwave"", ""AC - split type ductless system"", ""Milie Organics conditioner"", ""35 inch TV with Fire TV"", ""Indoor fireplace: electric, wood-burning"", ""Free parking on premises"", ""Cleaning products"", ""Wifi"", ""Private entrance"", ""Outdoor furniture"", ""Private backyard \u2013 Fully fenced"", ""Extra pillows and blankets"", ""Books and reading material"", ""Toaster"", ""Heating - split type ductless system"", ""Fire extinguisher"", ""Milie Organics body soap"", ""Milie Organics shampoo"", ""Cooking basics"", ""Dishwasher"", ""Lockbox"", ""Westinghouse benchtop plug in induction stove"", ""Shower gel"", ""Blender"", ""Long term stays allowed"", ""Dining table"", ""Private patio or balcony"", ""Mini fridge"", ""Freezer"", ""Clothing storage"", ""Mountain view"", ""Dedicated workspace"", ""Baking sheet"", ""Kitchen"", ""Hot water kettle"", ""Fender Bluetooth sound system"", ""Cleaning available during stay"", ""Bed linens"", ""Self check-in"", ""Portable fans"", ""Room-darkening shades"", ""Smoke alarm"", ""Wine glasses"", ""Essentials"", ""Iron"", ""Hot water""]",$178.00,1,14,1,3,1125,1125,1.0,1125.0,,t,21,42,70,154,2024-09-05,205,70,4,2022-03-05,2024-08-30,4.97,4.97,4.98,4.99,4.99,4.62,4.91,DA2021/23,f,1,1,0,0,6.71
3768,586481664504230932,https://www.airbnb.com/rooms/586481664504230932,20240905032138,2024-09-05,city scrape,Drumreagh Cabin 1- Modern style in country setting,"Kick back and relax in these calm, modern country style cabins.<br />Just 2 minutes drive from the iconic town of Deloraine which is centrally located, just 30 minutes drive from both Launceston and Devonport.<br />The cabin offers 2 bedrooms both with queen beds, sleeping a total of 4 guests.<br />At Drumreagh you can enjoy the peaceful surrounds, whilst still being close to the town.<br />The cabins offer tasteful decor, with all the comforts you could expect for a short getaway.",,https://a0.muscache.com/pictures/miso/Hosting-586481664504230932/original/2e22d5cb-0d7e-49ad-8d11-ca1d64cb2eda.jpeg,233596246,https://www.airbnb.com/users/show/233596246,Melissa,2019-01-01,"Deloraine, Australia",,within an hour,100%,95%,t,https://a0.muscache.com/im/pictures/user/User-233596246/original/4d93bf3c-d336-4654-9d68-ffefc3bdac64.jpeg?aki_policy=profile_small,https://a0.muscache.com/im/pictures/user/User-233596246/original/4d93bf3c-d336-4654-9d68-ffefc3bdac64.jpeg?aki_policy=profile_x_medium,,2,2,"['email', 'phone']",t,t,,Meander Valley,,-41.5097,146.67269,Farm stay,Entire home/apt,4,1.0,1 bath,2.0,2.0,"[""Dishes and silverware"", ""Body soap"", ""TV"", ""Outdoor dining area"", ""Drying rack for clothing"", ""Hangers"", ""Free dryer \u2013 In unit"", ""Hair dryer"", ""First aid kit"", ""Coffee"", ""Microwave"", ""Free parking on premises"", ""Cleaning products"", ""Shampoo"", ""Wifi"", ""Private entrance"", ""Outdoor furniture"", ""Air conditioning"", ""Extra pillows and blankets"", ""Books and reading material"", ""Toaster"", ""Heating - split type ductless system"", ""Fire extinguisher"", ""Cooking basics"", ""Oven"", ""Lockbox"", ""Clothing storage: wardrobe"", ""Long term stays allowed"", ""Washer"", ""Dining table"", ""Private patio or balcony"", ""Conditioner"", ""Breakfast"", ""Freezer"", ""Baking sheet"", ""Gas stove"", ""Luggage dropoff allowed"", ""Kitchen"", ""Hot water kettle"", ""Bed linens"", ""Self check-in"", ""Smoke alarm"", ""Room-darkening shades"", ""Wine glasses"", ""Refrigerator"", ""Essentials"", ""Shared backyard \u2013 Fully fenced"", ""Iron"", ""Hot water""]",$180.00,1,365,1,1,365,365,1.0,365.0,,t,16,27,48,285,2024-09-05,12,11,0,2023-07-11,2024-05-16,5.0,4.92,4.92,5.0,5.0,4.92,5.0,PA/07/0145,f,2,2,0,0,0.85
4557,817717675658963219,https://www.airbnb.com/rooms/817717675658963219,20240905032138,2024-09-05,city scrape,Binalong Bay Beach House,"Set in beautiful Binalong Bay, this modern 4-bedroom house has views over the beach and up to Eddystone Point. It boasts a large open plan light-filled living area with a large kitchen that all the family can enjoy. A short stroll down the street you have the choice of swimming in secluded and sheltered Gulches or a little further to the world-renowned Binalong Bay Beach and Bay of Fires. Whilst you're in the area call into the Easy Tiger complex for a coffee or a cocktail in the beer garden.","Binalong Bay is a very exclusive seaside village and is the gateway to the Bay of Fires.  The village has amazing gulches for swimming or exploring with lichen red rocks, a great protected boat ramp, and great beaches with the whitest sand and great surfing.    Binalong Bay has several coffee shops and a great restaurant and is only 10 minutes out of St Helens.",https://a0.muscache.com/pictures/miso/Hosting-817717675658963219/original/a411f33c-6028-4fcf-987b-5d967451038a.jpeg,485836862,https://www.airbnb.com/users/show/485836862,Yvette,2022-10-31,,,within an hour,100%,100%,t,https://a0.muscache.com/im/pictures/user/User-485836862/original/011b5cbc-5516-4c03-b67b-38ff1e77af16.jpeg?aki_policy=profile_small,https://a0.muscache.com/im/pictures/user/User-485836862/original/011b5cbc-5516-4c03-b67b-38ff1e77af16.jpeg?aki_policy=profile_x_medium,,1,2,"['email', 'phone']",t,t,Neighborhood highlights,Break O'Day,,-41.25217,148.31211,Entire home,Entire home/apt,10,2.0,2 baths,4.0,7.0,"[""Dishes and silverware"", ""Free washer \u2013 In building"", ""Body soap"", ""Bathtub"", ""Clothing storage: closet and wardrobe"", ""Fire pit"", ""Private hot tub"", ""Outdoor dining area"", ""Drying rack for clothing"", ""Hangers"", ""Board games"", ""Hair dryer"", ""First aid kit"", ""Coffee"", ""Microwave"", ""Private BBQ grill: gas"", ""Private outdoor kitchen"", ""AC - split type ductless system"", ""Ocean view"", ""Free parking on premises"", ""Sea view"", ""Wifi"", ""Private entrance"", ""Outdoor furniture"", ""Private backyard \u2013 Fully fenced"", ""Boat slip"", ""EV charger"", ""Beach view"", ""Extra pillows and blankets"", ""Barbecue utensils"", ""Coffee maker: espresso machine"", ""Free street parking"", ""Books and reading material"", ""Toaster"", ""Heating - split type ductless system"", ""Fire extinguisher"", ""Cooking basics"", ""Dishwasher"", ""Lockbox"", ""Blender"", ""Long term stays allowed"", ""Standalone high chair - available upon request"", ""Dining table"", ""Crib - available upon request"", ""Private patio or balcony"", ""Stainless steel single oven"", ""Freezer"", ""Dedicated workspace"", ""Baking sheet"", ""Gas stove"", ""Luggage dropoff allowed"", ""Ethernet connection"", ""Beach essentials"", ""75 inch HDTV with Amazon Prime Video, Disney+, Netflix"", ""Changing table - available upon request"", ""Bay view"", ""Kitchen"", ""Hot water kettle"", ""Cleaning available during stay"", ""Beach access \u2013 Beachfront"", ""Bed linens"", ""Self check-in"", ""Portable fans"", ""Room-darkening shades"", ""Smoke alarm"", ""Refrigerator"", ""Essentials"", ""Wine glasses"", ""Baby bath - available upon request"", ""Iron"", ""Hot water"", ""Babysitter recommendations""]",$431.00,2,90,2,2,1125,1125,2.0,1125.0,,t,26,51,76,311,2024-09-05,32,28,2,2023-02-12,2024-08-31,4.97,4.88,4.88,4.97,4.94,4.97,4.81,CT 60263/31,t,1,1,0,0,1.68
4841,898102977315322612,https://www.airbnb.com/rooms/898102977315322612,20240905032138,2024-09-05,city scrape,Drumreagh Cabin 2- Modern style in country setting,"Kick back and relax in these calm, modern country style cabins.<br />Just 2 minutes drive from the iconic town of Deloraine which is centrally located, just 30 minutes drive from both Launceston and Devonport.<br />The cabin offers 2 bedrooms both with queen beds, sleeping a total of  guests.<br />At Drumreagh you can enjoy the peaceful surrounds, whilst still being close to town.<br />The cabins offer tasteful decor, with all the comforts you could expect for a short getaway.",,https://a0.muscache.com/pictures/miso/Hosting-586481664504230932/original/b2906010-4d16-42a1-aa2a-f690574e8013.jpeg,233596246,https://www.airbnb.com/users/show/233596246,Melissa,2019-01-01,"Deloraine, Australia",,within an hour,100%,95%,t,https://a0.muscache.com/im/pictures/user/User-233596246/original/4d93bf3c-d336-4654-9d68-ffefc3bdac64.jpeg?aki_policy=profile_small,https://a0.muscache.com/im/pictures/user/User-233596246/original/4d93bf3c-d336-4654-9d68-ffefc3bdac64.jpeg?aki_policy=profile_x_medium,,2,2,"['email', 'phone']",t,t,,Meander Valley,,-41.50816954089024,146.67260919919738,Farm stay,Entire home/apt,4,1.0,1 bath,2.0,2.0,"[""Dishes and silverware"", ""Body soap"", ""TV"", ""Outdoor dining area"", ""Drying rack for clothing"", ""Hangers"", ""Hair dryer"", ""First aid kit"", ""Coffee"", ""Microwave"", ""Heating"", ""Free parking on premises"", ""Cleaning products"", ""Shampoo"", ""Wifi"", ""Private entrance"", ""Outdoor furniture"", ""Air conditioning"", ""Extra pillows and blankets"", ""Books and reading material"", ""Toaster"", ""Fire extinguisher"", ""Cooking basics"", ""Laundromat nearby"", ""Dryer"", ""Oven"", ""Lockbox"", ""Long term stays allowed"", ""Washer"", ""Dining table"", ""Crib - available upon request"", ""Private patio or balcony"", ""Conditioner"", ""Backyard"", ""Breakfast"", ""Freezer"", ""Clothing storage"", ""Baking sheet"", ""Kitchen"", ""Hot water kettle"", ""Stove"", ""Bed linens"", ""Self check-in"", ""Smoke alarm"", ""Room-darkening shades"", ""Wine glasses"", ""Refrigerator"", ""Essentials"", ""Iron"", ""Hot water""]",$180.00,1,365,1,1,365,365,1.0,365.0,,t,15,30,44,272,2024-09-05,24,22,0,2023-08-18,2024-07-02,5.0,5.0,4.96,5.0,5.0,5.0,4.96,PA/07/0145,f,2,2,0,0,1.87
5136,979258914495418780,https://www.airbnb.com/rooms/979258914495418780,20240905032138,2024-09-05,city scrape,Minutes from Spirit of Tasmania,"Enjoy a restful experience at this centrally located place.<br />What makes a difference at a short stay? Quality linen and amazing mattress, a quiet street, a spacious bathroom, privacy, a TV with Apps and ice in the the freezer!<br />That’s us.<br />You are a six minute drive from the Spirit of Tasmania and two minutes from the CBD and eateries.<br />We have gone out of our way to ensure comfort for a 1-2 night stay, as the reviews will attest to.",One of the most quiet streets in Devonport. Very easy to find when leaving the bridge / main road.,https://a0.muscache.com/pictures/d843c467-0fbd-4cc1-86d6-3c6b20256a32.jpg,15787932,https://www.airbnb.com/users/show/15787932,Melissa,2014-05-20,"Devonport, Australia","I am a friendly and easy going person who both uses Airbnb and lists my own lovely place as well.  Unless needed, I tend to keep to myself when staying at other accommodation and when other's are staying with me. We are often out and about or working, but always happy to share information on the surrounds and where to have fun.
Prior Hosting has been in Launceston and in Lennox Head.",within an hour,100%,100%,t,https://a0.muscache.com/im/pictures/user/User-15787932/original/ba6939a4-505a-4307-9528-eaa276d617ba.jpeg?aki_policy=profile_small,https://a0.muscache.com/im/pictures/user/User-15787932/original/ba6939a4-505a-4307-9528-eaa276d617ba.jpeg?aki_policy=profile_x_medium,,1,1,"['email', 'phone']",t,t,Neighborhood highlights,Devonport,,-41.18537366165243,146.35682335060585,Private room in home,Private room,2,1.0,1 private bath,1.0,1.0,"[""Dishes and silverware"", ""Body soap"", ""Radiant heating"", ""Hangers"", ""Room-darkening shades"", ""Hair dryer"", ""Coffee"", ""Cleaning products"", ""Paid washer \u2013 In unit"", ""Wifi"", ""Private entrance"", ""Outdoor furniture"", ""Paid dryer \u2013 In unit"", ""Extra pillows and blankets"", ""Bikes"", ""Free street parking"", ""Lockbox"", ""Shower gel"", ""HDTV with Netflix"", ""Mini fridge"", ""Freezer"", ""Paid crib - available upon request"", ""Hot water kettle"", ""Iron"", ""Free driveway parking on premises \u2013 1 space"", ""Bed linens"", ""Self check-in"", ""Wine glasses"", ""Lock on bedroom door"", ""Essentials"", ""Fire extinguisher""]",$95.00,1,3,1,1,3,3,1.0,3.0,,t,22,36,66,70,2024-09-05,41,41,0,2023-09-29,2024-06-29,4.88,4.85,4.9,4.88,4.83,4.88,4.8,Exempt: This listing falls under the 'home sharing' exemption,t,1,0,1,0,3.59
